{
  "$schema": "../../../../schemas/research/r0.02/semantic-preservation.schema.json",
  "data": {
    "semantic_preservation": [
      {
        "agent_repair_impact": "agent may need to reconstruct authoring context",
        "change_stage": "authoring validation, Cinema-to-React lowering, React-to-Scene lowering, or renderer prepass",
        "concept": "scene purpose",
        "confidence": "MEDIUM",
        "diagnostic_impact": "errors cannot always identify the originating intent",
        "disposition": "DROPPED",
        "editing_impact": "semantic edits become value-level edits after lowering",
        "incremental_compilation_impact": "coarse invalidation when source mapping is absent",
        "reversibility": "NO",
        "semantic_id": "SEM-001",
        "source_refs": [
          "S-CINEMA-TYPES",
          "S-CINEMA-COMPILER",
          "S-REACT-LOWER",
          "S-SCENE"
        ],
        "source_representation": "Cinema, React, or direct authoring representation",
        "target_representation": "renderer-facing Scene or pixels"
      },
      {
        "agent_repair_impact": "agent may need to reconstruct authoring context",
        "change_stage": "authoring validation, Cinema-to-React lowering, React-to-Scene lowering, or renderer prepass",
        "concept": "entry role",
        "confidence": "MEDIUM",
        "diagnostic_impact": "errors cannot always identify the originating intent",
        "disposition": "USED_ONLY_DURING_LOWERING",
        "editing_impact": "semantic edits become value-level edits after lowering",
        "incremental_compilation_impact": "coarse invalidation when source mapping is absent",
        "reversibility": "NO",
        "semantic_id": "SEM-002",
        "source_refs": [
          "S-CINEMA-TYPES",
          "S-CINEMA-COMPILER",
          "S-REACT-LOWER",
          "S-SCENE"
        ],
        "source_representation": "Cinema, React, or direct authoring representation",
        "target_representation": "renderer-facing Scene or pixels"
      },
      {
        "agent_repair_impact": "agent may need to reconstruct authoring context",
        "change_stage": "authoring validation, Cinema-to-React lowering, React-to-Scene lowering, or renderer prepass",
        "concept": "focal/support/ambient hierarchy",
        "confidence": "MEDIUM",
        "diagnostic_impact": "errors cannot always identify the originating intent",
        "disposition": "USED_ONLY_DURING_LOWERING",
        "editing_impact": "semantic edits become value-level edits after lowering",
        "incremental_compilation_impact": "coarse invalidation when source mapping is absent",
        "reversibility": "NO",
        "semantic_id": "SEM-003",
        "source_refs": [
          "S-CINEMA-TYPES",
          "S-CINEMA-COMPILER",
          "S-REACT-LOWER",
          "S-SCENE"
        ],
        "source_representation": "Cinema, React, or direct authoring representation",
        "target_representation": "renderer-facing Scene or pixels"
      },
      {
        "agent_repair_impact": "agent may need to reconstruct authoring context",
        "change_stage": "authoring validation, Cinema-to-React lowering, React-to-Scene lowering, or renderer prepass",
        "concept": "scene ID",
        "confidence": "MEDIUM",
        "diagnostic_impact": "errors cannot always identify the originating intent",
        "disposition": "DROPPED",
        "editing_impact": "semantic edits become value-level edits after lowering",
        "incremental_compilation_impact": "coarse invalidation when source mapping is absent",
        "reversibility": "NO",
        "semantic_id": "SEM-004",
        "source_refs": [
          "S-CINEMA-TYPES",
          "S-CINEMA-COMPILER",
          "S-REACT-LOWER",
          "S-SCENE"
        ],
        "source_representation": "Cinema, React, or direct authoring representation",
        "target_representation": "renderer-facing Scene or pixels"
      },
      {
        "agent_repair_impact": "agent may need to reconstruct authoring context",
        "change_stage": "authoring validation, Cinema-to-React lowering, React-to-Scene lowering, or renderer prepass",
        "concept": "track ID",
        "confidence": "MEDIUM",
        "diagnostic_impact": "errors cannot always identify the originating intent",
        "disposition": "DROPPED",
        "editing_impact": "semantic edits become value-level edits after lowering",
        "incremental_compilation_impact": "coarse invalidation when source mapping is absent",
        "reversibility": "NO",
        "semantic_id": "SEM-005",
        "source_refs": [
          "S-CINEMA-TYPES",
          "S-CINEMA-COMPILER",
          "S-REACT-LOWER",
          "S-SCENE"
        ],
        "source_representation": "Cinema, React, or direct authoring representation",
        "target_representation": "renderer-facing Scene or pixels"
      },
      {
        "agent_repair_impact": "agent may need to reconstruct authoring context",
        "change_stage": "authoring validation, Cinema-to-React lowering, React-to-Scene lowering, or renderer prepass",
        "concept": "entry ID",
        "confidence": "MEDIUM",
        "diagnostic_impact": "errors cannot always identify the originating intent",
        "disposition": "USED_ONLY_AS_REACT_KEY",
        "editing_impact": "semantic edits become value-level edits after lowering",
        "incremental_compilation_impact": "coarse invalidation when source mapping is absent",
        "reversibility": "NO",
        "semantic_id": "SEM-006",
        "source_refs": [
          "S-CINEMA-TYPES",
          "S-CINEMA-COMPILER",
          "S-REACT-LOWER",
          "S-SCENE"
        ],
        "source_representation": "Cinema, React, or direct authoring representation",
        "target_representation": "renderer-facing Scene or pixels"
      },
      {
        "agent_repair_impact": "agent may need to reconstruct authoring context",
        "change_stage": "authoring validation, Cinema-to-React lowering, React-to-Scene lowering, or renderer prepass",
        "concept": "labels",
        "confidence": "MEDIUM",
        "diagnostic_impact": "errors cannot always identify the originating intent",
        "disposition": "DROPPED",
        "editing_impact": "semantic edits become value-level edits after lowering",
        "incremental_compilation_impact": "coarse invalidation when source mapping is absent",
        "reversibility": "NO",
        "semantic_id": "SEM-007",
        "source_refs": [
          "S-CINEMA-TYPES",
          "S-CINEMA-COMPILER",
          "S-REACT-LOWER",
          "S-SCENE"
        ],
        "source_representation": "Cinema, React, or direct authoring representation",
        "target_representation": "renderer-facing Scene or pixels"
      },
      {
        "agent_repair_impact": "agent may need to reconstruct authoring context",
        "change_stage": "authoring validation, Cinema-to-React lowering, React-to-Scene lowering, or renderer prepass",
        "concept": "component name",
        "confidence": "MEDIUM",
        "diagnostic_impact": "errors cannot always identify the originating intent",
        "disposition": "USED_ONLY_DURING_LOWERING",
        "editing_impact": "semantic edits become value-level edits after lowering",
        "incremental_compilation_impact": "coarse invalidation when source mapping is absent",
        "reversibility": "NO",
        "semantic_id": "SEM-008",
        "source_refs": [
          "S-CINEMA-TYPES",
          "S-CINEMA-COMPILER",
          "S-REACT-LOWER",
          "S-SCENE"
        ],
        "source_representation": "Cinema, React, or direct authoring representation",
        "target_representation": "renderer-facing Scene or pixels"
      },
      {
        "agent_repair_impact": "agent may need to reconstruct authoring context",
        "change_stage": "authoring validation, Cinema-to-React lowering, React-to-Scene lowering, or renderer prepass",
        "concept": "component property semantics",
        "confidence": "MEDIUM",
        "diagnostic_impact": "errors cannot always identify the originating intent",
        "disposition": "MATERIALIZED",
        "editing_impact": "semantic edits become value-level edits after lowering",
        "incremental_compilation_impact": "coarse invalidation when source mapping is absent",
        "reversibility": "NO",
        "semantic_id": "SEM-009",
        "source_refs": [
          "S-CINEMA-TYPES",
          "S-CINEMA-COMPILER",
          "S-REACT-LOWER",
          "S-SCENE"
        ],
        "source_representation": "Cinema, React, or direct authoring representation",
        "target_representation": "renderer-facing Scene or pixels"
      },
      {
        "agent_repair_impact": "agent may need to reconstruct authoring context",
        "change_stage": "authoring validation, Cinema-to-React lowering, React-to-Scene lowering, or renderer prepass",
        "concept": "choreography pattern",
        "confidence": "MEDIUM",
        "diagnostic_impact": "errors cannot always identify the originating intent",
        "disposition": "MATERIALIZED",
        "editing_impact": "semantic edits become value-level edits after lowering",
        "incremental_compilation_impact": "coarse invalidation when source mapping is absent",
        "reversibility": "NO",
        "semantic_id": "SEM-010",
        "source_refs": [
          "S-CINEMA-TYPES",
          "S-CINEMA-COMPILER",
          "S-REACT-LOWER",
          "S-SCENE"
        ],
        "source_representation": "Cinema, React, or direct authoring representation",
        "target_representation": "renderer-facing Scene or pixels"
      },
      {
        "agent_repair_impact": "agent may need to reconstruct authoring context",
        "change_stage": "authoring validation, Cinema-to-React lowering, React-to-Scene lowering, or renderer prepass",
        "concept": "choreography parameters",
        "confidence": "MEDIUM",